{
  "id": "JP",
  "name": "Japan",
  "description": "Creator and developer monetization reference entry for Japan.",
  "category": "country",
  "country_code": "JP",
  "currency": {
    "code": "JPY",
    "name": "Japanese Yen"
  },
  "tax_notes": "needs_verification: Tax treatment depends on residence, entity type, income source, and platform. Contributors should cite current official guidance for specific claims.",
  "payout_platforms": ["Stripe", "PayPal", "Bank transfer", "Platform-specific payouts"],
  "developer_platform_notes": "Availability and payout support vary by platform. Verify each platform's current Japan support pages before use.",
  "tags": ["japan", "monetization", "creators"],
  "sources": [
    {
      "title": "National Tax Agency Japan",
      "url": "https://www.nta.go.jp/english/",
      "type": "official",
      "last_checked": "2026-07-05"
    }
  ],
  "last_checked": "2026-07-05",
  "notes": "Initial entry. This is not tax, legal, or accounting advice."
}
